<?xml version="1.0" encoding="UTF-8"?>
<!DOCTYPE install SYSTEM "http://web.magti.ge/pda/defines/xml/grid.dtd">
<install type="component" version="1.5.0">
	<filters class="page_filter_block" type="h">
		<!--<filter name="org" type="org" default="" label="org" class="kbd" />-->
<!--		<filter name="lastname" type="text" default="" label="lastname" class="kbd" />
		<filter name="position" type="text" default="" label="position" class="kbd"  />-->
		<!--<filter name="department" type="department" default="" label="department" />-->
		<!--<filter name="chapter" type="chapter" default="" label="chapter" />-->
		<!--<filter name="user_role" type="userrole" default="" label="User_Role" />-->
		<!--<filter type="buttons" default="" submit_label="Filter" reset_label="Clear" show_reset= "1" />-->
	</filters>
	<params class="table table-bordered table-condensed table-hover table-striped">
		<param order="" type="number" default="" label="#" rclass="text-center" />
		<param order="workername" type="workers" label="worker" key="WORKERNAME" id='ID' rclass="text-left" />
		<param order="u.position" type="print" label="position" key="POSITION" rclass="text-left" />
		<param order="u.org_place" type="print" label="org_place" key="ORG_PLACE" rclass="text-center" />
		<param order="u.user_type" type="usertype" label="user_type" key="USER_TYPE" rclass="text-center" />
		<param order="u.id" type="print" label="ID" key="ID" rclass="text-center" />
	</params>
</install>