<?xml version="1.0" encoding="UTF-8"?>
<!DOCTYPE install SYSTEM "http://web.magti.ge/pda/defines/xml/grid.dtd">
<install type="component" version="1.5.0">
	<filters class="table table-bordered table-condensed table-filter-vertical" type="v">
		<filter name="firstname" type="stext" default="" label="firstname" class="kbd"  />
		<filter name="lastname" type="stext" default="" label="lastname" class="kbd"  />
		<filter name="start_date" type="calendar" default="now - 7 days" label="Start Date" />
		<filter name="end_date" type="calendar" default="now" label="End Date" />
		<filter name="cat_id" type="category" default="-1" label="category"  />
		<filter name="org" type="org" default="" label="org" />
		<filter name="org_place" type="unit" default="" label="unit" />
		<filter type="buttons" default="" submit_label="Filter" reset_label="Clear" show_reset= "1" />
	</filters>

</install>