<?xml version="1.0" encoding="UTF-8"?>
<!DOCTYPE install SYSTEM "http://web.magti.ge/pda/defines/xml/grid.dtd">
<install type="component" version="1.5.0">
	<filters class="table table-bordered table-condensed table-filter-vertical" type="v">
		<filter name="firstname" type="stext" default="" label="firstname" class="kbd"  />
		<filter name="lastname" type="stext" default="" label="lastname" class="kbd"  />
		<filter name="private_number" type="stext" default="" label="private_number" class="kbd"  />
		<filter name="staff_schedule" type="stext" default="" label="staff_schedule" class="kbd"  />
		<filter name="position" type="stext" default="" label="position" class="kbd"  />
		<filter name="org" type="org" default="" label="org" />
		<filter name="org_place" type="unit" default="" label="unit"  elementid="org" />
		<filter name="start_date" type="calendar" default="now" label="Start Date" />
		<filter name="end_date" type="calendar" default="now" label="End Date" />
		<filter name="cat_id" type="category" default="-1" label="category"  />
<!--		<filter name="c_resolution" type="state" default="0" label="status">
			<option value="-1">select category</option>
			<option value="0">PENDING</option>
			<option value="1">ACCEPTED</option>
			<option value="2">DECLINED</option>
		</filter>-->
		<filter type="buttons" default="" submit_label="Filter" reset_label="Clear" show_reset= "1" />
	</filters>

</install>