<?xml version="1.0" encoding="UTF-8"?>
  <!DOCTYPE install SYSTEM "http://web.magti.ge/pda/defines/xml/grid.dtd">
<install type="component" version="1.5.0">
	<params class="table table-bordered table-condensed table-hover table-striped">
		<param order="" type="number" default="" label="#" rclass="text-center" hclass="text-center" />
		<param order="" type="checkall" default="" label="" rclass="text-center"   />
		<param order="t.lib_title" type="editlink" label="Title" key="LIB_TITLE" rclass="text-left" T="1"/>
		<param order="t.lib_desc" type="print" label="Description" key="LIB_DESC" rclass="text-left" />
		<param order="t.lib_tin" type="print" label="tin" rclass="text-center" key="LIB_TIN" />
		<param order="t.active" type="state" label="State" rclass="text-center" state_id='ID' state_key="ACTIVE" hclass="text-center"/>
		<param order="t.ordering" type="print" label="ordering" key="ORDERING" rclass="text-center" hclass="text-center"/>
		<param order="t.id" type="print" label="ID" key="ID" rclass="text-center" hclass="text-center"/>
	</params>
</install>