<?xml version="1.0" encoding="UTF-8"?>
  <!DOCTYPE install SYSTEM "http://web.magti.ge/pda/defines/xml/grid.dtd">
<install type="component" version="1.5.0">
	<filters class="page_filter_block" type="h">
		<filter name="lib_title" type="stext" default="" label="TEXT_SEARCH" class="kbd" />
		<filter name="active" type="state" default="-1" label="State">
			<option value="-1">Select State</option>
			<option value="0">Inactive</option>
			<option value="1">Active Status</option>
		</filter>
		<filter type="buttons" default="" submit_label="Filter" reset_label="Clear" show_reset= "1" />
	</filters>
	<params class="table table-bordered table-condensed table-hover table-striped">
		<param order="" type="number" default="" label="#" rclass="text-center" />
		<param order="" type="checkall" default="" label="" rclass="text-center"   />
		<param order="t.lib_title" type="editlink" label="Title" key="LIB_TITLE" rclass="text-left" T="1"/>
		<param order="t.lib_goal" type="print" label="LIB_GOAL" key="LIB_GOAL" rclass="text-left" />
		<param order="t.active" type="state" label="State" rclass="text-center" state_id='ID' state_key="ACTIVE" />
		<param order="t.ordering" type="print" label="ordering" key="ORDERING" rclass="text-center" />
		<param order="t.id" type="print" label="ID" key="ID" rclass="text-center" />
	</params>
</install>